code_name,ticker,created_at,text
交通银行,sh.601328,2024-12-04,交通银行积极践行社会责任，为山西省某国企提供全方位、境内外联动的跨境金融服务方案，支持其港股上市。这对交通银行的股价可能产生积极影响，因为这表明交通银行在服务实体经济、推动金融创新方面的卓越能力得到了认可，有利于提升其市场竞争力和品牌形象。
交通银行,sh.601328,2024-12-04,交通银行深圳分行开展了一系列主题为“交灌未来 守护童心”的公益活动，用爱和行动为特殊儿童群体撑起一片希望的天空。这些公益活动体现了交通银行的社会责任感和品牌形象，有利于提升其社会影响力和美誉度，进而对股价产生积极影响。
交通银行,sh.601328,2024-12-04,交通银行深圳分行通过生动有趣的方式教导孩子们掌握了基础金融知识，还通过情景模拟向孩子们传授了反诈、反洗钱等防范知识，培养了他们的金融意识。这些举措体现了交通银行在金融教育方面的投入和创新，有利于提升其社会形象和品牌影响力，进而对股价产生积极影响。
交通银行,sh.601328,2024-12-04,交通银行山西省分行助力国企港股上市 谱写金融服务篇章。作为国有大型商业银行，交通银行积极践行社会责任，为山西省某国企提供全方位、境内外联动的跨境金融服务方案，支持其港股上市。交通银行山西省分行深耕实体经济，强化外汇合规，聚焦汇率风险，优化资金配置，与企业深化合作，共创双赢。通过此次合作，交通银行不仅展示了在服务实体经济、推动金融创新方面的卓越能力，也为更多企业提供了可借鉴的范例。未来，交通银行将继续秉承“以客户为中心”的服务理念，深化金融服务创新，为实体经济的高质量发展贡献更多力量，书写金融服务新篇章。（CIS）
交通银行,sh.601328,2024-12-04,交通银行深圳分行开展“交灌未来 守护童心”关爱特殊儿童系列公益活动。为积极履行社会责任，给予特殊儿童群体更多的关怀，自今年6月以来，交通银行深圳分行携手香蜜湖街道办，精心策划了一系列主题为“交灌未来 守护童心”的公益活动，用爱和行动为特殊儿童撑起一片希望的天空。6月15日，“交灌未来 守护童心”公益活动在东海缤纷广场盛大启动。活动现场气氛热烈，吸引了众多市民参与。7月29日，交通银行深圳香蜜支行网点迎来了22名外来务工人员子女，银行工作人员通过生动有趣的方式教导孩子们掌握了基础金融知识，还通过情景模拟向孩子们传授了反诈、反洗钱等防范知识，让他们在互动中学会如何辨别诈骗陷阱。针对家庭困难儿童，交通银行深圳分行量身定制了“小小音乐魔法家”及“小小金融家”两大专属公益课程。这些课程寓教于乐，不仅丰富了孩子们的知识储备，更在潜移默化中培养了他们的艺术素养和金融意识。11月25日，交通银行深圳分行联合东海社区党群服务中心组织了一场别出心裁的非遗竹编生肖 DIY活动。活动邀请了竹编非遗传承人现场展示精湛技艺，并指导孩子们亲手制作竹编生肖。在家长的陪伴和工作人员的鼓励下，孩子们勇敢地尝试，一个个灵动的生肖作品在孩子们的手中诞生。通过开展这一系列活动，交通银行深圳分行不仅为孩子们提供了学习金融知识与自我保护知识的平台，更给予了他们陪伴与温暖。这些活动不仅丰富了孩子们的精神世界，提高了他们的自我保护意识和动手能力，更在社区内营造了关爱儿童成长的良好氛围。未来，交通银行深圳分行将继续秉持“金融为民”的初心，积极探索更多创新形式的公益活动，在传递金融知识的同时，传递更多的爱与温暖。（CIS）
