code_name,ticker,created_at,text
交通银行,sh.601328,2024-09-25,支付便利化宣传活动。交通银行深圳分行开展支付便利化宣传活动，提升境外来华人士及广大市民的支付体验，推广数字人民币的安全支付，有望吸引更多用户使用该行服务，可能对交通银行股价产生积极影响。
交通银行,sh.601328,2024-09-25,反假币、反电诈意识提升。交通银行深圳分行联合新洲社区党委举办“新洲活力集，温暖零距离”党员服务市集活动，向社区居民讲解如何辨别假币和电信网络诈骗典型案例，提高公众的金融安全素养和风险防范意识。这有助于减少金融欺诈事件，降低银行风险，可能对交通银行股价产生积极影响。
交通银行,sh.601328,2024-09-25,社区服务和品牌形象提升。交通银行深圳分行联合新洲社区党委举办党员服务市集活动，提供金融知识三堂课、火眼金睛识假币、支付便利享无忧等服务，加强与社区居民的联系，提升该行在社区的品牌形象。这有助于该行拓展社区业务，增加客户黏性，可能对交通银行股价产生积极影响。
交通银行,sh.601328,2024-09-25,"金融为民 温暖邻里 ——交通银行深圳分行开展支付便利化宣传活动。（原标题：金融为民 温暖邻里    ——交通银行深圳分行开展支付便利化宣传活动）
为进一步提升境外来华人士及广大市民的支付体验，强化公众反假币、反电诈意识，近日，交通银行深圳分行联合新洲社区党委在福田区绿景佐阾新邑购物中心举办了“新洲活力集，温暖零距离”党员服务市集活动，为社区居民开设“金融知识三堂课”。火眼金睛识假币活动现场，交通银行深圳分行的工作人员向居民们派发了第五套人民币防伪特征宣传折页，并提供了多种面值的人民币供大家辨别。工作人员用通俗易懂的方式向社区居民讲解了如何辨别假币，并在现场设置了趣味有奖问答环节，吸引了众多青少年儿童参加。支付便利享无忧银行工作人员还向社区居民介绍了交通银行零钱包服务。社区居民不仅可以随时到银行网点兑换，还能享受到银行提供的上门服务，充分享受“零钱自由”。针对社区的境外来华群体，工作人员详细介绍了交通银行关于境外来华人士个人账户便利化的各项服务措施以及数字人民币的安全支付小技巧，引导大家更多使用数字人民币，畅享支付无忧。警银携手反电诈最后，交通银行深圳分行联合沙头派出所民警，向社区居民讲解电信网络诈骗典型案例，提醒大家不要贪图蝇头小利，务必警惕诈骗新手法，不做电诈工具人。未来，交通银行深圳分行将继续秉承“金融为民”的宗旨，加强政银、警银合作，助力提升人民群众金融安全素养和风险防范意识，为社会的和谐发展贡献金融力量。（CIS）"
