code_name,ticker,created_at,text
海尔智家,sh.600690,2021-11-17,大宗交易：今日海尔智家共发生2笔大宗交易，合计成交量393.60万股，成交金额1.18亿元。其中，2笔成交价相对收盘价均为溢价交易。近3个月内，海尔智家累计发生4笔大宗交易，合计成交金额为1.26亿元。
海尔智家,sh.600690,2021-11-17,股价表现：海尔智家今日收盘价为27.52元，下跌1.57%，日换手率为0.36%，成交额为6.27亿元，全天主力资金净流出3006.80万元。近5日，海尔智家累计上涨9.08%，资金合计净流入4.34亿元。
海尔智家,sh.600690,2021-11-17,战略合作：红星美凯龙与海尔智家的战略合作进一步升级，双方将于2022年在红星美凯龙再添320家三翼鸟门店，实现触点100%进驻率，冲刺渠道零售50亿，加速覆盖场景新赛道。
海尔智家,sh.600690,2021-11-17,海尔智家现2笔大宗交易 合计成交393.60万股。海尔智家11月17日大宗交易平台共发生2笔成交，合计成交量393.60万股，成交金额1.18亿元。以折溢价进行统计，今日2笔大宗交易成交价相对收盘价均为溢价交易。进一步统计，近3个月内该股累计发生4笔大宗交易，合计成交金额为1.26亿元。证券时报•数据宝统计显示，海尔智家今日收盘价为27.52元，下跌1.57%，日换手率为0.36%，成交额为6.27亿元，全天主力资金净流出3006.80万元，近5日该股累计上涨9.08%，近5日资金合计净流入4.34亿元。两融数据显示，该股最新融资余额为7.36亿元，近5日减少8674.07万元，降幅为10.54%。北向资金动态上，沪股通最新持有该股5.75亿股，近5日增加3690.18万股，增幅为6.86%。（数据宝）11月17日海尔智家大宗交易一览成交量（万股）成交金额（万元）成交价格（元）相对当日收盘折溢价（%） 买方营业部卖方营业部238.607091.1929.727.99华泰证券股份有限公司上海杨浦区国宾路证券营业部华泰证券股份有限公司无锡分公司155.004691.8530.279.99华泰证券股份有限公司上海杨浦区国宾路证券营业部华泰证券股份有限公司无锡分公司注：本文系新闻报道，不构成投资建议，股市有风险，投资需谨慎。超级复盘、主力资金超级复盘、主力资金 大宗交易、大宗成交、折溢价、折价、溢价
海尔智家,sh.600690,2021-11-17,红星美凯龙与海尔智家战略合作进一步升级。证券时报e公司讯，记者获悉，红星美凯龙与海尔智家战略合作进一步升级，在资源互补、店面拓展、联合营销、展会招商等基础上，双方将于2022年于红星美凯龙再添320家三翼鸟门店，实现触点100%进驻率，冲刺渠道零售50亿，加速覆盖场景新赛道。
