code_name,ticker,created_at,text
海光信息,sh.688041,2024-09-30,股价创新高：海光信息股价今天创下了历史新高，达到了101.85元。
海光信息,sh.688041,2024-09-30,成交量和成交金额增加：今天的成交量和成交金额都比以往增加了不少，分别达到了3308.93万股和31.75亿元。
海光信息,sh.688041,2024-09-30,融资客加仓：近10天内，融资客加仓了6844.70万元，环比增长了6.09%。
海光信息,sh.688041,2024-09-30,"海光信息股价创新高，融资客抢先加仓。海光信息股价创出历史新高，截至13:42，该股上涨18.31%，股价报101.85元，成交量3308.93万股，成交金额31.75亿元，换手率3.73%，该股最新A股总市值达2367.34亿元，该股A股流通市值902.96亿元。
证券时报•数据宝统计显示，海光信息所属的电子行业，目前整体涨幅为12.42%，行业内，目前股价上涨的有466只，涨停的有国民技术、东微半导等33只。股价下跌的有1只，跌幅居前的有*ST美讯等，跌幅分别为1.78%。
两融数据显示，该股最新（9月27日）两融余额为12.02亿元，其中，融资余额为11.92亿元，近10日增加6844.70万元，环比增长6.09%。"
