code_name,ticker,created_at,text
保利发展,sh.600048,2023-12-11,保利发展拟回购股份，公司实控人计划增持；
保利发展,sh.600048,2023-12-11,新致软件拟3.8亿元购买上海房产；
保利发展,sh.600048,2023-12-11,"公告精选：保利发展拟回购股份，公司实控人计划增持；新致软件拟3.8亿元购买上海房产；金自天正：少量订单项目涉及人工神经网络算法；腾景科技：精密光学元组件产品需求情况存在不确定性；*ST商城：预计重整计划实施后，股价会较大幅度向下除权调整；吉电股份：拟14.76亿元收购六家新能源项目公司少数股权；兴发集团：控股股东拟1亿元-2亿元增持公司股份；紫金矿业：旗下巴布亚新几内亚波格拉金矿将全面复产；新致软件：拟3.8亿元购买上海市浦东新区房产；*ST商城：预计重整计划实施后，股价会较大幅度向下除权调整；美亚柏科：拟变更公司证券简称为“国投智能”；吉电股份：拟14.76亿元收购六家新能源项目公司少数股权；通策医疗：拟控股娄底口腔，并购加盟模式将首次落地；联泰环保：为控制公司经营风险，业绩承诺方将回购天汇健股权；日科化学：2023年预盈1亿元至1.2亿元，同比降39%至49%；
<|im_start|>"
保利发展,sh.600048,2023-12-11,A股回购大单频现  保利发展拟以10亿元—20亿元回购股份。增持、回购潮再起，上市公司大额回购不停歇。12月11日晚间，上市公司回购公告再次密集涌现，其中不乏回购大单。保利发展11日晚间发布公告，拟于3个月内回购公司股票，回购总额不低于10亿（人民币），不超过20亿，回购价格不超过15.19元/股。具体回购价格由公司董事会授权公司经营层在回购实施期间，结合二级市场股票价格确定。与此同时，保利发展还披露，公司实控人中国保利集团有限公司(以下简称“保利集团”)计划在未来12个月内，通过集中竞价交易方式增持公司A股股份，增持金额不低于人民币2.5亿元，不超过人民币5亿元，增持价格不超过15.19元/股，资金来源为保利集团自有或自筹资金。“鉴于公司目前股票收盘价格低于最近一期每股净资产，为维护公司价值和股东权益，促进公司健康可持续发展，基于对公司未来发展前景的信心和对公司股票价值的认可，结合公司的经营情况、财务状况及未来的盈利能力。”介绍本次回购的原因时，保利发展如此表示。抛出大额回购计划的还有合盛硅业，公司拟5亿元—10亿元回购公司股份，回购价不超80.4元/股。拟回购资金来源为公司自有资金。合盛硅业回购股份将全部用于员工持股计划或股权激励，并在披露股份回购实施结果暨股份变动公告日后一年内予以转让；若公司未能在上述期限内转让完毕本次回购的股份，尚未使用的已回购股份将予以注销。此外，11日晚间，兴发集团公告，控股股东拟1亿元—2亿元增持公司股份；天源环保公告，拟以5000万元—1亿元回购公司股份；恒通股份拟4000万元—8000万元回购公司股份；林州重机公告，实控人之子拟500万元—1000万元增持公司股份。除了回购方案，还有不少公司披露回购进展。新宝股份11日晚间公告，已通过集中竞价交易方式完成股份回购方案，累计回购股份数量为484.72万股，占总股本的0.59%，最高成交价17.2元/股，最低成交价15.73元/股，共计支付回购总金额7998.96万元。近期，上市公司增持、回购热情高涨，仅12月10日晚，A股就有超40家上市公司披露股份回购与股东增持计划。大手笔回购屡见不鲜，郑煤机10日晚间公告，收到董事长焦承尧的提议，拟不低于3亿元、不超过6亿元，以集中竞价交易方式回购公司部分A股股份，回购价格上限不超过13.00元/股。珀莱雅同日公告，实控人提议以1亿元—2亿元回购股份。分析认为，回购能够向市场传达出公司价值可能被低估的信号，在一定程度上提振市场信心。增持、回购潮不断，上市公司以真金白银传递投资信心，进一步夯实了市场平稳运行的基础。
保利发展,sh.600048,2023-12-11,公告精选：保利发展拟回购股份，公司实控人计划增持；新致软件拟3.8亿元购买上海房产。证券时报e公司讯，12月11日晚间公告精选：南京商旅称公司主营未发生重大变化，仅开展少量跨境电商业务；*ST商城预计重整计划实施后，股价会较大幅度向下除权调整；吉电股份拟14.76亿元收购六家新能源项目公司少数股权；通策医疗拟控股娄底口腔，并购加盟模式将首次落地；联泰环保披露，为控制公司经营风险，业绩承诺方将回购天汇健股权；日科化学2023年预盈1亿元至1.2亿元，同比降39%至49%；保利发展拟10亿元至20亿元回购股份，公司实控人计划2.5亿元至5亿元增持；兴发集团控股股东拟1亿元至2亿元增持公司股份；养元饮品拟回购股份500万股至1000万股，用于注销并减少公司注册资本；玉禾田中标遵义市城乡环卫一体化特许经营项目，服务年限25年，合计总额64.19亿元；紫金矿业旗下巴布亚新几内亚波格拉金矿将全面复产；新致软件拟3.8亿元购买上海市浦东新区房产。
