code_name,ticker,created_at,text
保利发展,sh.600048,2024-09-30,"近期公司发布的半年报数据显示，保利发展上半年共实现营业总收入1392.49亿元，同比增长1.62%，实现净利润74.20亿元，同比下降39.29%。这可能会影响投资者对保利发展的信心和预期，从而影响股价。
"
保利发展,sh.600048,2024-09-30,"保利发展近日表现强劲，连收3个涨停板，累计上涨33.05%，累计换手率为6.85%。这可能是由于市场对公司未来发展的乐观预期，或者是短期资金的炒作所致，但需要注意的是，连续涨停后可能会面临回调风险。
"
保利发展,sh.600048,2024-09-30,从两融数据来看，保利发展最新两融余额为25.78亿元，其中融资余额25.60亿元，较前一个交易日增加4544.33万元，环比增长1.81%，近3日累计增加7021.30万元，环比增长2.82%。这表明市场资金对保利发展有一定的关注度和信心，但也需要注意融资余额的波动风险。
保利发展,sh.600048,2024-09-30,保利发展连收3个涨停板。保利发展盘中涨停，已连收3个涨停板，截至9:25，该股报11.03元，换手率0.20%，成交量2350.23万股，成交金额2.59亿元，连续涨停期间，该股累计上涨33.05%，累计换手率为6.85%。最新A股总市值达1320.34亿元。证券时报•数据宝统计，两融数据来看，该股最新（9月27日）两融余额为25.78亿元，其中，融资余额25.60亿元，较前一个交易日增加4544.33万元，环比增长1.81%，近3日累计增加7021.30万元，环比增长2.82%。8月20日公司发布的半年报数据显示，上半年公司共实现营业总收入1392.49亿元，同比增长1.62%，实现净利润74.20亿元，同比下降39.29%。（数据宝）近日该股表现日期当日涨跌幅（%）换手率（%）主力资金净流入（万元）2024.09.279.983.7315765.562024.09.2610.012.9231256.282024.09.251.472.30-6652.912024.09.241.112.33-6195.432024.09.230.371.13-7926.472024.09.201.771.54-5985.912024.09.193.671.692867.782024.09.182.011.02-649.152024.09.13-0.130.544697.562024.09.12-0.270.42-1907.55注：本文系新闻报道，不构成投资建议，股市有风险，投资需谨慎。智能盯盘涨停、连续涨停、异动、行情、涨幅、大涨
保利发展,sh.600048,2024-09-30,保利发展连收3个涨停板。保利发展盘中涨停，已连收3个涨停板，截至9:25，该股报11.03元，换手率0.20%，成交量2350.23万股，成交金额2.59亿元，连续涨停期间，该股累计上涨33.05%，累计换手率为6.85%。最新A股总市值达1320.34亿元。
