code_name,ticker,created_at,text
保利发展,sh.600048,2024-07-10,"上海土拍市场重回""价高者得""，保利发展溢价两成拿地，成为市场关注的焦点。"
保利发展,sh.600048,2024-07-10,此次土拍的4幅地块全部成功出让，总成交金额约91.33亿元，其中关注度最高的杨浦区平凉社区02H1-01地块获9位竞买人竞逐，最终被保利发展拿下，溢价率达到21.18%。
保利发展,sh.600048,2024-07-10,此次土拍取消了最高限价，房企总体表现比较理性，并未盲目挑战更高溢价率，但这也显示出房企愿意接受一定的高成本，城市中心区域的优质地块还是会吸引中高端改善型买家。
保利发展,sh.600048,2024-07-10,溢价超21%！保利发展上海抢地。7月9日，激烈的土拍厮杀在酷暑中的申城上演。这是上海“527新政”叠加恢复“价高者得”后的首场土拍，某种程度上可视为观察机制变化、市场态度以及房企预期的重要窗口。此次被出让的4幅地块分别位于杨浦、宝山和奉贤，地块位置直接决定了市场热度。开拍前，房企意向名单流出，冷热分化显著，位于市区的两幅杨浦地块得到多家房企青睐，其中内环内的沿江地块平凉社区更是吸引了华润、保利、中海、招商等11家国央企争抢，宝山顾村地块和奉贤新城地块由于只有一家企业报名，提前锁定底价出让。上午，大热地块——杨浦平凉社区88街坊率先被摆上货架，起拍价约18.18亿元，对应单价59999.99元/平方米。平凉社区88街坊地块 孙婉秋摄该地块位于杨浦滨江，东至渭南路，西至眉州路，北至杭州路，地块占地面积约1.38万平方米，容积率为1.8，建筑计容面积2.5万平方米左右，限高24米，住宅套数不少于190套。项目距离黄浦江直线距离不到500米，地理位置优越，周边配套成熟，汇聚了4/12/18三条轨道交通，500米范围内集中了复旦妇产科医院、杨浦区中医医院、上海第一康复医院等多所医院。平凉88街坊地块周边 吴典摄起拍伊始，中海、北京城建和越秀联合体以及绿城、上海城投率先出价。其中，北京城建和越秀联合体表现积极，前30回合中出价9次，保利发展则显得颇为沉住气，直到第30回合才开始第一次举牌，此时场上的玩家只剩保利发展、北京城建和越秀联合体以及上海城投三家。后发制人的保利发展火力全开，连续7次1000万元的加价直接将现场总价拉至21.6172亿元，北京城建和越秀联合体勉强再跟一轮后，彻底放弃。随后现场进入保利发展和上海城投的双雄争霸环节，经过8个回合的火拼，双方将价格提至22.0172亿元，此时地块溢价已超21%。保利发展继续再加100万元，最终以22.0272亿元的价格将地块收入囊中，成交楼面价88465元/平方米，溢价21.18%。如果剔除700平方米和5%的配建保障房，该地块可售部分楼面价为95815元/平方米。事实上，在赛前，保利发展就已对该地块显露出志在必得之心。上海市建设工程交易服务中心网站显示，早在6月24日，保利发展就以上海保硕置业有限公司的名义发布了该地块的项目招标计划公告，公告称该项目总投资为32亿元。根据企查查，上海保硕置业有限公司于2024年6月17日成立，为保利发展全资子公司，保利发展上海公司总经理傅小君担任董事长。市场认为此番保利发展“抢地”杨浦，意在深耕，与区域内现有项目形成联动。当前，保利发展在杨浦滨江板块已落数子。今年4月，其联手杨浦国资14.9亿元拿下平凉街道45街坊地块。有意思的是，去年7月，保利发展的兄弟公司保利置业摘得杨浦滨江平凉街道另一幅地块，该项目已取证目前正在认购中，均价11.7万元。今日，有在现场的购房者表示工作人员为了鼓励大家认购，直言保利发展今日所拿地块开盘价或超13万元，价差之下，买到即赚到。由于上海没有明文确认是否取消限价（房地联动价），这也意味着未来项目上市时可能会出现两种情况，最终利润表现也差异较大。有测算认为，如果保利发展项目最终按照12.3万的限价开盘，利润率仅约2.7%。越秀项目按照11万，利润率6%左右（不包含额外成本）。如果突破限价，今日所拍平凉社区地块未来开盘价若较此前联动价（12.3万元）上涨5%，那么在溢价率达20%、楼面价8.76万元/平方米的情况下，该地块的利润率将在5%左右。有房企投拓人士告诉记者，每家房企的投资模型不一样，因为测算出的结果也存在差异。杨浦另一宗长白社区地块起始价约19.04亿元，引来5家开发商围猎，现场竞价到79轮方才出结果。平凉社区地块上失意的北京城建和越秀联合体这次笑到了最后，以22.3亿元的总价拿下地块，成交楼面价70272元/平方米，溢价率为17.12%。宝山顾村地块则被招商蛇口联合中旅投资拿下，成交价31.12亿元，楼面价22252元/平方米。奉发集团以15.88亿元兜底了奉贤区奉贤新城12单元地块，楼面价17000元/平方米。至此，上海2024年第三批次土拍4宗地块全部完成出让，平均溢价率8.4%，总成交金额约91.33亿元。
保利发展,sh.600048,2024-07-10,保利发展溢价两成拿地 上海土拍市场重回“价高者得”。7月9日，上海迎来下半年首场土地拍卖。这是上海取消土拍限价，恢复“价高者得”后的首场土拍，此次出让的4幅地块全部成功出让，其中关注度最高的杨浦区平凉社区02H1-01地块获9位竞买人竞逐，最终“花”落保利发展，溢价率达到21.18%。上海中原地产市场分析师卢文曦表示，从此次上海土拍的结果来看，尽管取消最高限价，房企总体表现比较理性，并未盲目挑战更高溢价率。从目前市场情况来看，在政策利好推动下，成交放量，市场信心开始回归。土拍溢价率也是前期指标之一，说明房企对未来市场尤其是高端改善市场的前景看好。此前一日，“上海土地交易市场”微信公众号发布通知，将于7月9日出让4幅涉宅地块使用权，4幅地块分别位于杨浦区、宝山区和奉贤区，出让面积共约15.29万平方米，起始价合计约84.22亿元。杨浦区平凉社区02H1-01地块是此次4幅地块中最热的地块，共吸引包括华润、保利、绿城、招商、建发在内的9位竞买人参拍。该地块现场竞价起始价为18.1772亿元，各位竞买人渐次出价，竞价过程比较平稳，从第45轮出价开始，该地块的争夺就集中在7号竞买人和3号竞买人之间。最终经过60轮出价，7号竞买人保利发展旗下上海保利建锦城市发展有限公司以22.0272亿元斩获该地块，成交楼板价为88462元/平方米，溢价率21.18%。卢文曦表示，杨浦区平凉社区地块面积只有约1.38万平方米，面积不大的情况下总价可控，对开发商来说不会有太大的资金负担。由于本次土拍采取价高者得的方式，加之近期上海楼市情绪有所升温，地块溢价率超过10%也在意料之中。这显示出房企愿意接受一定的高成本，城市中心区域的优质地块还是会吸引中高端改善型买家，并且保利发展在该区域内还有其他项目，项目的潜在客户资源可以共享，销售压力不会太大。其余3幅地块中，杨浦区长白社区H2-17地块由城建发展与越秀地产组成的联合体摘得，成交价22.3023亿元，溢价率17.12%；宝山区顾村大型居住社区地块和奉贤区奉贤新城12单元地块均以底价成交。4幅地块成交总价约为91.33亿元。5月27日，上海发布了《关于优化本市房地产市场平稳健康发展政策措施的通知》。为落实关于优化土地供应的工作要求，6月7日，上海市土地交易市场发布今年上海市第三批次商品住房用地出让公告，共计4幅地块，其中2幅地块位于中心城范围，1幅地块位于主城片区，1幅地块位于新城。自该批次起，上海取消商品住房用地溢价率10%的上限要求，成交地价由市场化竞价确定，进一步提升土地资源市场化配置效率。同策研究院研究总监宋红卫认为，上海楼市具有风向标意义，这也是大量开发商集中在上海拍地的原因。土拍规则调整后，上海楼市回到市场定价的轨道，更能贴近市场真实情况，尤其是土地资源配置将会更高效。本次土拍结果也体现出政策的效果，中心城区的土地以及未来打造的住宅产品均有提升的空间，这与上海改善需求主导的情况相匹配，同时也能降低一、二手房价格倒挂的情况，也有利于开发商打造高端产品，降低中心城区产品的同质化竞争的程度。上海中心城区高端住宅未来产品会更加丰富，更能满足不同消费群体的需求。同时，也应看到，外围市场仍面临一定压力，即使放开土拍限价，外围土地的底价成交也反映出开发商越来越理性，越来越精打细算。
