code_name,ticker,created_at,text
国电南瑞,sh.600406,2024-10-24,国电南瑞荣膺“2024中国上市公司ESG百强”，这彰显了公司的可持续发展新高度。入选该榜单需要在环境保护、社会责任履行及公司治理方面有卓越表现，这将有助于提升公司的声誉和影响力，吸引更多的投资者关注和参与。
国电南瑞,sh.600406,2024-10-24,国电南瑞再次获得上交所信息披露A类评价，这是公司连续10年获此殊荣。信息披露是衡量公司高质量发展的重要指标，获得A类评价表明公司在信息披露的规范性、有效性等方面表现优异，有助于提升投资者对公司的信任和认可度。
国电南瑞,sh.600406,2024-10-24,国电南瑞在节能减排、废水处理和废气排放控制等领域取得了显著成绩，这将有助于提升公司的环保形象和可持续发展能力。同时，公司积极参与社会公益活动，用善行义举反哺社会，用科技赋能乡村振兴，努力写好民生答卷，这将有助于提升公司的社会形象和影响力。
国电南瑞,sh.600406,2024-10-24,国电南瑞荣膺“2024中国上市公司ESG百强” 彰显可持续发展新高度。10月24日，第十八届中国上市公司价值论坛暨2024新质生产力巡礼长三角行在江苏省昆山市举行。本次论坛将携手昆山市政府、上市公司高管等约500人，共同探讨市场最新趋势和推动资本市场高质量发展等话题。论坛上，备受瞩目的“2024中国上市公司ESG百强”榜单正式发布，国电南瑞(600406)凭借其在环境保护、社会责任履行及公司治理方面的卓越表现，成功入选。此次评选由权威财经媒体平台证券时报主办，旨在推动上市公司加大ESG（环境、社会、公司治理）领域的实践力度，引导企业践行新发展理念，助力中国经济的可持续、高质量发展。据了解，公司还获得了“主板价值百强”“新质生产力50强”“阳光董秘”奖项。作为能源电力及工业控制领域的领军企业，国电南瑞始终将可持续发展作为核心战略目标，致力于通过创新技术引领行业转型升级，并在全球能源结构调整和绿色发展中扮演重要角色。在ESG战略上，国电南瑞秉承“绿色低碳、创新引领、可持续发展”的理念，设定了明确的环保、社会责任和公司治理目标，不仅在环境保护方面表现突出，还在推动社会进步和优化治理结构上做出了积极贡献。环境保护方面，国电南瑞始终坚持绿色发展道路，以公司绿色转型为引领，以能源绿色降碳为基础，严格落实企业能源节约与生态环境保护的主体责任。公司积极响应国家“双碳”目标，持续推动节能降碳、清洁能源和低碳技术研发等方面持续投入和创新，通过产品、技术和服务为绿色高质量发展道路做出卓越贡献。此外，国电南瑞在节能减排、废水处理和废气排放控制等领域也取得了显著成绩，进一步提升了环境管理水平。社会责任方面，国电南瑞始终坚持社会责任与企业发展并重，积极参与社会公益活动，用善行义举反哺社会，用科技赋能乡村振兴，努力写好民生答卷。同时，国电南瑞重视员工发展与权益保障，推动人才培养、提升工作环境，营造包容、多元、健康的工作氛围，持续为社会进步贡献力量。在公司治理方面，国电南瑞坚持依法履责、诚信合规、透明运营，着力完善法人治理结构，健全管理制度，强化企业内部控制与风险管理，持续提升公司治理能力和高质量发展水平，为公司可持续发展保驾护航。公司还注重与投资者、监管机构及社会各界的有效沟通，确保信息披露的透明度与及时性，赢得了资本市场的广泛信任。通过持续完善治理体系，国电南瑞在提高经营效率、增强市场竞争力的同时，也确保了企业的长期可持续发展。此次荣获“2024中国上市公司ESG百强”称号，不仅是对国电南瑞在环境保护、社会责任履行及公司治理方面成绩的高度认可，更展现了公司在践行可持续发展理念上的坚定决心。未来，国电南瑞将继续加强ESG战略布局，秉承“努力超越、追求卓越”的企业精神，不断提升在能源变革中的引领作用，为实现中国经济高质量发展和全球可持续发展贡献更多力量。
国电南瑞,sh.600406,2024-10-24,国电南瑞：再获上交所信息披露A类评价。近日，上海证券交易所发布沪市上市公司2023至2024年度信息披露工作评价结果，国电南瑞(600406)再次获得最高评级——A类评价，这是公司连续10年获此殊荣。据公开数据统计，沪市上市公司中连续8年获得信息披露工作A类评价的公司仅为61家。信息披露工作评价是上海证券交易所对上市公司信息披露质量、投资者关系管理、履行社会责任等工作情况的综合评价，主要围绕信息披露的规范性、有效性等方面开展考核评价，评价结果分为A类（优秀）、B类（良好）、C类（合格）、D类（不合格）四个等级。本评价周期共有2247家上市公司参加沪市信息披露评价考核，425家公司获得A类评价，占比18.9%。全面注册制改革实施以来，信息披露重要性不断提升，上市公司信息披露水平成为衡量其高质量发展的重要指标。2024年新“国九条”和资本市场“1+N”政策落地见效，对上市公司市值管理提出更高要求。国电南瑞始终坚持以规范运作为起点，以价值实现为落脚点，不断提升信息披露的有效性及规范性，持续重视投资者关系管理工作，并通过投资者关系管理，推动提升公司运作规范化水平。公司大幅提高现金分红比例，积极落实中期分红，不断提高投资者回报。下一阶段，国电南瑞继续以信息披露准则规范公司经营管理，兼顾不同利益主体需求，保障信息披露的完整性和有效性，积极创新，充分发挥投资者关系管理工作的双向桥梁作用，提升公司治理水平，增进投资者对公司价值的认同，树立公司在资本市场的良好形象，发挥板块龙头上市公司模范带头作用。（CIS）
