code_name,ticker,created_at,text
金山办公,sh.688111,2021-01-26,金山办公2020年净利预增100%-130%：金山办公发布业绩预告，预计公司2020年净利润约8.01亿元至9.21亿元，同比增长100%-130%。这将对金山办公的股价产生积极影响。
金山办公,sh.688111,2021-01-26,企业及个人用户云协作、云办公需求增加：金山办公为更多的企业及个人用户提供了优质的云协作、云办公应用服务，推动了机构授权业务实现了高速增长，机构订阅业务体量增加，个人订阅业务继续保持较高增速。这表明金山办公在云办公市场上的竞争力较强，未来有望继续保持增长。
金山办公,sh.688111,2021-01-26,疫情影响下移动办公及云协作办公需求增加：疫情刺激下，移动办公及云协作办公深入改变用户使用习惯，进而带动金山办公的业绩增长。这意味着金山办公在远程办公市场上的前景较为乐观。
金山办公,sh.688111,2021-01-26,公告精选：沈阳化工大幅上修业绩预告；金山办公2020年净利预增100%-130%。证券时报e公司讯，沈阳化工大幅上修业绩预告：2020年度预盈2.8亿元-4.1亿元；水井坊业绩预告：2020年净利润同比下降约11%；京东方A：拟63.4亿元受让绵阳京东方部分股权 持股比例增至90.42%；比亚迪：高管李柯拟减持不超过100万股A股；金山办公：2020年净利预增100%-130%；远东股份：孙公司与小牛电动签订逾9亿元意向战略采购协议；激智科技：股东拟转让5%公司股份引入战投小米科技。
金山办公,sh.688111,2021-01-26,金山办公：2020年净利预增100%-130%。证券时报e公司讯，金山办公(688111)26日晚公告，预计公司2020年净利润约8.01亿元至9.21亿元，同比增长100%-130%。2020年度，公司为更多的企业及个人用户提供了优质的云协作、云办公应用服务。报告期内，机构授权业务实现了高速增长；随着企业级云化需求逐渐显现，机构订阅业务体量增加；在疫情刺激下，移动办公及云协作办公深入改变用户使用习惯，进而带动个人订阅业务继续保持较高增速。推动公司业绩大幅增长。
