code_name,ticker,created_at,text
金山办公,sh.688111,2024-08-20,"订阅业务的增长：金山办公的核心增长引擎订阅业务在2024上半年实现了19.73亿元的收入，同比增长22.17%，占总收入比约82%，同比提升近5个百分点。这显示出订阅业务对于金山办公的重要性以及其持续的增长趋势。
2. WPS AI的商业化进程：金山办公在2024上半年推出了WPS AI 2.0，并在个人版、企业版、政务版中进行了创新应用，帮助用户和客户提升办公新质生产力。同时，WPS AI的数十项AI功能也同步迁移至鸿蒙平台，为用户提供全场景多端协同，更高效便捷的办公体验。这显示出WPS AI在金山办公业务中的重要性和市场潜力。
3. 机构订阅及服务业务的进展：金山办公的机构订阅及服务业务在2024上半年实现了4.43亿元的收入，同比增长5.95%。同时，WPS 365已服务超过18000家头部政企客户，覆盖金融、能源、通信、交通等行业。这显示出金山办公在机构订阅及服务业务方面的进展和市场份额。"
金山办公,sh.688111,2024-08-20,金山办公上半年净利7.21亿元增两成  WPS 365服务超18000家头部政企客户。8月20日晚间，金山办公正式公布了2024半年报数据。上半年营业收入24.13亿元，同比增长11.09%；归属于母公司所有者净利润7.21亿元，同比增长20.38%；归属于母公司所有者扣除非经常性损益净利润6.88亿元，同比增长19.35%。一个值得关注的变化是订阅业务。作为金山办公的核心增长引擎，此类业务2024上半年收入19.73亿元，占总收入比约82%，同比提升近5个百分点。具体来看，国内个人订阅业务收入15.30亿元，同比增长22.17%；国内机构订阅及服务业务收入4.43亿元，同比增长5.95%。此外，金山办公合同负债总额达26.85亿元，这被视为公司业务长期发展的基础。今年上半年，随着WPS AI开启商业化进程，金山办公累计年度付费个人用户增长至3815万，主要产品月活设备数达6.02亿，均创历史新高。机构业务方面，WPS 365全面嵌入AI能力，企业客户在公有云市场的渗透率不断加强，SaaS模式转型初见成效。据悉，截至报告期末，WPS 365已服务超过18000家头部政企客户，覆盖金融、能源、通信、交通等行业。2024上半年，金山办公研发投入8.08亿元，占收入比约33%，研发费用同比增长12.61%。迭代升级AI及协作产品是研发的重要一维。今年7月，金山办公发布WPS AI 2.0，通过在个人版、企业版、政务版的创新应用，帮助用户和客户提升办公新质生产力。报告期内，金山办公还与华为等合作伙伴紧密协作，共同开展了一系列基础设施的构建和完善工作。首次推出的WPS鸿蒙版，在全端流畅运行，实现了多平台账号统一、跨端调用和跨屏协同。WPS AI的数十项AI功能也同步迁移至鸿蒙平台，为用户提供全场景多端协同，更高效便捷的办公体验。值得一提的是，作为2024年奥运会中国体育代表团官方协同办公软件供应商，WPS 365在2024年巴黎奥运会期间充分发挥产品服务优势，保障中国体育代表团的多地办公、跨国办公、移动办公、场景化办公和协同办公等需求，确保应急处置能力。截至2024年6月30日，金山办公股东总户数为1.92万户，较上季度（3月31日）增加2350户，增幅为13.93%，连续2个季度增加。2024年二季度，金山办公二级市场股价整体上震荡走弱。在这段时间，北上资金进行了加仓操作。根据公司半年报，截至二季度末，香港中央结算有限公司(陆股通)持股数量达到2160.95万股，较一季度末增仓了近180万股。
金山办公,sh.688111,2024-08-20,金山办公：上半年净利润7.21亿元 同比增长20.38%。证券时报e公司讯，金山办公(688111)8月20日晚间披露半年报，2024年上半年实现营业收入24.13亿元，同比增长11.09%；净利润7.21亿元，同比增长20.38%。
