code_name,ticker,created_at,text
工商银行,sh.601398,2024-08-21,国家电影局与中国工商银行签署战略合作协议，可能成为影响工商银行股价的因素之一。协议的签署可能提升工商银行的社会形象和品牌知名度，同时为其带来新的业务机会和收入来源，对股价产生积极影响。
工商银行,sh.601398,2024-08-21,工商银行成为A股市值新“一哥”，可能成为影响工商银行股价的因素之一。工商银行市值超越中国移动，成为A股新的“市值一哥”，显示了市场对其业绩和前景的认可，对股价产生积极影响。
工商银行,sh.601398,2024-08-21,银行板块的整体表现可能成为影响工商银行股价的因素之一。当天银行板块实现“三连涨”，全年更是累计涨逾20％，大幅跑赢同期上证指数。作为银行板块的龙头之一，工商银行的股价可能受到整个板块表现的影响。
工商银行,sh.601398,2024-08-21,国家电影局与中国工商银行签署战略合作协议。证券时报e公司讯，8月21日上午，国家电影局与中国工商银行举行战略合作协议签约仪式。此次签约标志着国家电影局与中国工商银行正式开启全面深入合作，双方将在国产电影创作生产和宣传发行、扩大电影市场消费、支持电影基础设施升级发展、完善电影产业链、提升中国电影国际影响力、支持电影科技发展等各方面携手创新、锐意进取，共同努力推动电影强国与金融强国建设。
工商银行,sh.601398,2024-08-21,2.28万亿元！工商银行成A股市值新“一哥”。8月20日，中国A股上市公司市值榜榜首易主：工商银行超过中国移动，成为A股新的“市值一哥”。当天，工商银行股价上涨1.91％，总市值约2.28万亿元（人民币，下同），超越中国移动的2.26万亿元，登顶中国A股市值榜。值得注意的是，当天A股市值榜的前十席中，上市银行共占据五席，依次分别为工商银行（第一）、建设银行（第三）、农业银行（第五）、中国银行（第七）、招商银行（第十）。当天A股总体走势偏弱，银行板块亦小幅下跌0.1％，但该板块过去3个交易日已实现“三连涨”，全年更是累计涨逾20％，大幅跑赢同期上证指数。个股方面，工商银行、建设银行、农业银行、中国银行股价继续走强，按前复权计算，这国有“四大行”股价均续创历史新高。华福证券分析师张宇表示，今年以来，银行板块的行情主要是因为三方面驱动因素：一是股息率选股逻辑在板块内的扩散，高股息策略从国有行扩散到中小行；二是房地产政策的放松；三是市场对于银行净息差下行斜率放缓以及行业基本面即将见底的期待。就当天市场的总体表现而言，截至收盘，上证指数报2866点，跌幅为0.93%；深证成指报8252点，跌幅为1.24%；创业板指报1567点，跌1.34%。
