code_name,ticker,created_at,text
海天味业,sh.603288,2024-08-30,立体化渠道效果凸显。海天味业通过及时消费洞察、持续研发攻坚、适时推出新品、完善渠道布局等一整套“组合拳”，打开全新增长空间，实现业绩持续稳健向好。其中，立体化渠道布局是其业绩增长的重要因素之一。
海天味业,sh.603288,2024-08-30,新品推出助力业绩增长。海天味业围绕消费者个性化需求在健康趋势类产品方面推出了200余款，覆盖消费者绿色健康饮食需求的方方面面。此外，还针对特殊人群，专设哺乳期宝妈、留学生、老年人等专业对口客服。这些新品的推出和优质的服务体验赢得了消费者青睐，助力了业绩增长。
海天味业,sh.603288,2024-08-30,成本压力缓解。海天味业半年报显示，得益于调味品消费频次高、具备一定需求刚性的特点，调味品行业过往基本保持相对稳健的发展。消费需求的多样性、餐饮行业的复苏态势初显、预制菜等关联产业的生态形成等因素，可能会给调味品行业的发展创造一定的空间。同时，大宗原材料的价格总体呈现行情回调走势，在一定程度上有利于公司缓解成本压力。
海天味业,sh.603288,2024-08-30,“立体化渠道”效果凸显 海天味业上半年营收净利双增长。今日，海天味业(603288)发布2024年中期报告。报告期内，海天味业实现营业收入141.56亿元，增长9.18%；归属于上市公司股东的净利润34.53亿元，同比增长11.52%。今年上半年，受整体经济形势、市场竞争、新消费需求变动等叠加因素影响，调味品行业迎来多重挑战，综合竞争实力面临重新考验。作为调味品行业的标杆企业，海天味业凭借着及时消费洞察、持续研发攻坚、适时推出新品、完善渠道布局等一整套“组合拳”，打开全新增长空间，实现业绩持续稳健向好！捕捉消费新动能，“加码”新品助业绩增长公开数据显示，海天味业围绕“更健康、更轻盈、更营养”理念，不仅对现有产品品质进行了再次全面升级，还围绕消费者个性化需求在健康趋势类产品方面推出了200余款，覆盖消费者绿色健康饮食需求的方方面面。不仅推出了获得三国认证的有机酱油、有机蚝油、有机黄豆酱等有机系列；还针对快时尚生活，推出了海天紫苏酱、黑松露素蚝油、藤椒味招牌拌饭酱等多种市场追捧快捷调味品。最值得称赞的是，这个百年老字号企业开放自己，拥抱互联网，稳稳接住了消费者的情绪价值，不仅别出心裁的推出了“专门给水果吃的酱油”水果嗞嗞酱油，还推出了水果味番茄沙司，开创“补充维C”新方式，很让年轻人受用。持续优化消费体验，用细节品质“俘获”消费者赢得消费者青睐，优质产品很关键，高品质的服务体验同样至为关键。记者了解到，为了及时捕捉消费者需求，海天味业设置了360°客户服务体系，要求客户诉求“零遗漏”，沟通渠道覆盖消费者客服、电商客服、经销商客服，沟通语言不仅普通话还有粤语和英语。尤为值得注意的是，海天味业还针对特殊人群，专设哺乳期宝妈、留学生、老年人等专业对口客服。以“耐心听、能听懂、能共情”沟通模式和要求让消费者感受到“用心服务”。不仅如此，海天味业还花式创新，将各种“零距离”沟通进行到底。自2023年来，相继邀请广佛两地的市民共计4万多人走进阳光工厂，与消费者“对话”品质；在线上，通过年味节、干饭节、水果酱油等主题以美食为桥梁进行沟通；通过独家冠名《脱口秀和TA的朋友们》等综艺节目与年轻消费者进行在线造梗互动等活动。基于“零距离”的沟通模式，海天味业在产品定位、功能诉求、口味口感、包装便捷、规格矩阵等多方面进行持续改革创新。以包装体验为例，2021年海天味业围绕玻璃瓶蚝油倒出难等痛点，创新研发并推出PET材质的鱼型瓶身蚝油挤挤装，凭借着美观便捷和绿色环保等多重特性，上市后很快赢得市场和行业的积极反响，短短3年销量突破2亿瓶。今年6月，海天再度突破技术限制推出黄豆酱挤挤装，首次实现挤挤装在固体颗粒上的应用，解决过去只能解决勺取、倒出等使用痛点。包装体验品质，还有上述提到的喷雾装产品，一嗞到位、精准控量，满足消费者精致时尚的个性化需求。立体化销售布局，“革新渠道”实现精准用户触达随着消费升级和消费习惯变迁，作为传统制造的调味品企业也相继在因时而变、把握趋势及时开辟新增长点。除了产品和服务，渠道能力和交付能力也成为至关重要的决胜砝码。诚如外界所知，经销网络布局广、渠道多样一直是海天领先许多同行的突出优势。记者了解到，近年来除了优化传统分销网络质量、加强镇村覆盖率，海天味业还不断强化多场景产品开发和多渠道销售，基于经销商、批发商以及终端零售店等不同业务场景的需求，用数字化技术方案实现与目标用户的有效触达及联动。赋能线下销售转型升级的同时，渠道费用投入亦更加精准。在线上，海天广泛聚焦电商、社交媒体、社区团购等消费者高度触达的平台，助力线上业务稳增。海天味业在2024年年报中强调，将构建“敏捷响应、便捷交付”立体化渠道，保障产品向用户的高效触达。2024年上半年，其线上渠道销售、线下渠道销售，分别实现增长8.26%和29.17%，成果凸显。在新消费时代的机遇和挑战下，“对外主动求变，对内修炼内功”是这家经营数百年老字号企业的发展密码。在持续提升产品力、服务力、渠道力、交付力等“多重合力”下，海天味业还有更多增长空间待解锁。（文穗）
海天味业,sh.603288,2024-08-30,大宗原材料价格回调 海天味业半年报净利润重回两位数增长。8月29日晚间，A股调味品龙头海天味业(603288)披露2024年半年报，公司上半年实现营业收入141.56亿元，同比增长9.18%；实现归母净利润34.53亿元，同比增长11.52%；实现扣非归母净利润33.25亿元，同比增长11.95%。基本每股收益0.62元。被市场称为“酱油茅”的海天味业，在上市之后的几年中，曾一度持续保持两位数高速增长，但近几年增长失速。2021年至2023年，海天味业的净利润增速分别为4.18%、-7.09%和-9.21%。业绩表现持续下滑，也使得公司从2021年巅峰期的近7000亿元市值，跌落至如今不到2000亿元。不过，2024年半年报，海天味业的净利润增速恢复至两位数。增长的原因包括公司通过提升产品品质、丰富产品规格提升存量产品竞争力，并围绕消费者需求开发和推出新产品；积极推进渠道端的建设与变革，创新业务模式；大宗原材料的价格总体呈现行情回调走势，在一定程度上有利于公司缓解成本压力；持续推行提质增效创造利润空间，为公司的高品质产品、高效率运营和长期稳健发展提供有力支撑。海天味业表示，得益于调味品消费频次高、具备一定需求刚性的特点，调味品行业过往基本保持相对稳健的发展。消费需求的多样性、餐饮行业的复苏态势初显、预制菜等关联产业的生态形成等因素，可能会给调味品行业的发展创造一定的空间。分具体产品表现情况来看，今年上半年，海天味业的酱油、调味酱、蚝油、其他产品分别实现销售同比增长6.85%、8.55%、5.71%、22.31%。其中，酱油产品营收72.64亿元，占公司总收入的51.31%。增速最快的其他产品实现营收9.72亿元，该类产品主要包括醋和料酒等，也是海天味业多元化的发力方向。分渠道来看，上半年，海天味业线下渠道实现销售125.78亿元，同比增长8.26%；线上渠道实现销售6.06亿元，同比增长29.17%。公司表示，综合电商平台、社交媒体、新零售渠道等迅速发展，消费者的触达场景、消费场景已高度碎片化，全渠道的交付模式变得立体多元，要求企业直面挑战，加快重构供应与销售体系、积极推进数字化营销能力建设、全面提升创新能力；但新渠道的发展也为企业扩大品牌影响力、拓展产品销售地域、密切与消费者的联系提供了新机遇。半年报披露后，国金证券对此发布研报点评称，在下游餐饮需求承压背景下，公司实现韧性增长，主要受益于前期库存消化及产品创新、渠道拓展并行，Q2全品类实现增长。公司经销商优化动作基本完成，数量重启增长。24H1末经销商数量为6674家，较年初净增加168家。国金证券认为，行业逐步进入饱和阶段，预计产品升级为核心驱动力，看好海天味业借助品牌和渠道打造的平台化优势，持续提升细分品类市占率。尽管酱油市场规模趋于饱和，健康化、功能化细分方向仍具备机会，同时公司注重对工业端、小B端的定制化服务，有望抓住差异化增长机会，顺利完成全年双位数增长目标。
